{
  "id": "VE-2024-ACT-CANDIDATE-RESTRICTIONS",
  "event_id": "VE-2024-EVENT-PRESIDENTIAL-ELECTION",
  "title": "Restricciones arbitrarias a candidaturas opositoras",
  "date": "2024-03-26",
  "action": "La Plataforma Unitaria no pudo inscribir a la ganadora de sus primarias, María Corina Machado, ni inicialmente a su segunda opción, Corina Yoris; el CNE alegó un problema tecnológico sin explicación suficiente para esta última.",
  "institutions": ["VE-I-CNE", "VE-I-TSJ"],
  "persons": [],
  "evidence": ["CC-2025-VENEZUELA-FINAL:pp.5,17-19"],
  "assessment": "El Centro Carter calificó las decisiones de registro como arbitrarias y concluyó que el proceso de inscripción no cumplió estándares internacionales.",
  "limitations": ["Las personas excluidas se registran como afectadas, no como responsables del acto."]
}
